{
  "schemaVersion": "0.1.0",
  "registryId": "m1-vertical-slice-node-recipes",
  "status": "CREATOR_REVIEW",
  "coordinateAuthority": "data/alphabet-topology.json",
  "creatorApprovalRequiredForAssignments": true,
  "recipes": [
    {
      "coordinate": "A",
      "assignmentStatus": "CANONICAL",
      "structuralRole": "COMMON_ORIGIN",
      "canonicalIdentity": "−∞ / THRESHOLD",
      "concept": {
        "id": "threshold-common-origin",
        "title": "THRESHOLD",
        "statement": "A is the common origin where orientation, consent and the first consequential signal become possible.",
        "question": "What are you willing to activate, and under which conditions?",
        "epistemicStatus": "CANONICAL_PROJECT_CONSTRUCT"
      },
      "worldIds": ["threshold-world"],
      "content": {
        "sourceIds": ["EXPERIENCE_ARCHITECTURE", "ALPHABET_TOPOLOGY"],
        "visualActivatorIds": ["KODEX_THRESHOLD_MANDALA"],
        "provenanceStatus": "RECORDED_CANONICAL_STRUCTURE",
        "rightsStatus": "CREATOR_AUTHORED_REVIEWED_FOR_INTERNAL_PROTOTYPE",
        "culturalStatus": "PROJECT_CONSTRUCT_NO_EXTERNAL_CULTURAL_CLAIM"
      },
      "graph": {
        "entryConditions": ["CANONICAL_SESSION_START", "OR_EXPLICIT_REENTRY_FROM_Y"],
        "exits": [
          {
            "target": "B",
            "relationId": "A_TO_B_FIRST_SIGNAL",
            "condition": "CONSENT_RECORDED AND ACTION_ORIENT_SIGNAL",
            "consequence": "Signal becomes the first active relation.",
            "priority": 90,
            "serendipityEligible": false
          },
          {
            "target": "C",
            "relationId": "A_TO_C_FIRST_TRACE",
            "condition": "CONSENT_RECORDED AND ACTION_OPEN_TRACE",
            "consequence": "The journey begins through evidence and archive relation.",
            "priority": 85,
            "serendipityEligible": false
          },
          {
            "target": "H",
            "relationId": "A_TO_H_FIRST_RELATION",
            "condition": "CONSENT_RECORDED AND ACTION_MAP_RELATION",
            "consequence": "The journey begins through relational orientation.",
            "priority": 80,
            "serendipityEligible": false
          }
        ],
        "portalToM": {
          "state": "RESONANT",
          "conditions": ["CONSENT_RECORDED", "AT_LEAST_ONE_MEANINGFUL_ACTION"],
          "returnBehavior": "RESTORE_A_WITH_UPDATED_ORIENTATION_STATE"
        }
      },
      "interaction": {
        "meaningfulActions": [
          {
            "id": "ORIENT_SIGNAL",
            "label": "Orient toward signal",
            "kind": "COMMIT",
            "consequence": "Prioritizes the signal field and records the first authored direction.",
            "memoryWrites": ["CONSENT_RECORDED", "A_ORIENTATION_SIGNAL"]
          },
          {
            "id": "OPEN_TRACE",
            "label": "Open the first trace",
            "kind": "COMMIT",
            "consequence": "Prioritizes provenance and memory as the initial mode of traversal.",
            "memoryWrites": ["CONSENT_RECORDED", "A_ORIENTATION_TRACE"]
          },
          {
            "id": "MAP_RELATION",
            "label": "Map the first relation",
            "kind": "COMMIT",
            "consequence": "Prioritizes relational structure as the initial mode of traversal.",
            "memoryWrites": ["CONSENT_RECORDED", "A_ORIENTATION_RELATION"]
          }
        ],
        "passiveEffects": ["POINTER_PARALLAX_ONLY", "NO_CONSEQUENTIAL_MEMORY_FROM_HOVER"]
      },
      "memory": {
        "reads": ["ACCESSIBILITY_PREFERENCES", "CONSENT_STATE"],
        "writes": ["SESSION_STARTED", "CONSENT_RECORDED", "FIRST_ORIENTATION"],
        "revisitMutation": "A revisited after Y presents the prior trace as a re-entry seed without fabricating a new beginning."
      },
      "organism": {
        "family": "FIELD",
        "presetId": "threshold-portal",
        "renderMode": "IMAGE_FIELD",
        "implementationStatus": "PROTOTYPE",
        "fallback": "/img/kodex/works/mandala-0cin-negativo.png",
        "reducedMotion": "STATIC_SOURCE_WITH_DISCRETE_SIGNAL_PULSE",
        "semanticControls": {
          "signal": 0.62,
          "memory": 0.18,
          "entropy": 0.22,
          "cohesion": 0.82,
          "depth": 0.66,
          "convergence": 0.34
        },
        "contextualVariants": ["A_FIRST_ENTRY", "A_REENTRY_AFTER_Y"]
      },
      "presentationMode": "ORGANISM",
      "spectrum": {
        "entry": ["OBSIDIAN"],
        "active": ["OBSIDIAN", "RED"],
        "yContribution": ["COMMON_ORIGIN", "FIRST_ORIENTATION"]
      },
      "returnContribution": ["FIRST_ACTION", "CONSENT_AND_ACCESSIBILITY_STATE", "INITIAL_DIRECTION"],
      "accessibility": {
        "keyboard": true,
        "touch": true,
        "reducedMotion": true,
        "motionOff": true,
        "nonVisualAlternative": true,
        "immediateExit": true
      }
    },
    {
      "coordinate": "B",
      "assignmentStatus": "NEEDS_CREATOR_APPROVAL",
      "structuralRole": "INTERWOVEN_CONCEPT_NODE",
      "concept": {
        "id": "signal-vortex",
        "title": "SIGNAL VORTEX",
        "statement": "Signal becomes visible through attraction, interference and convergence around a changing center.",
        "question": "When many signals converge, what remains distinguishable?",
        "epistemicStatus": "AUTHORED_INTERPRETATION"
      },
      "worldIds": ["machine-world", "cosmology-world"],
      "content": {
        "sourceIds": ["KODEX_SIGNAL_VORTEX_REFERENCE"],
        "visualActivatorIds": ["SIGNAL_VORTEX_PROCEDURAL_FIELD"],
        "provenanceStatus": "INTERNAL_REFERENCE_AND_PROCEDURAL_PROTOTYPE",
        "rightsStatus": "CREATOR_REVIEW_REQUIRED_BEFORE_PUBLICATION",
        "culturalStatus": "PROJECT_CONSTRUCT_NO_EXTERNAL_CULTURAL_CLAIM"
      },
      "graph": {
        "entryConditions": ["FROM_A_SIGNAL_ORIENTATION", "OR_VALID_RELATION_FROM_C_H_K"],
        "exits": [
          {
            "target": "H",
            "relationId": "B_TO_H_SIGNAL_BECOMES_ORBIT",
            "condition": "ACTION_OBSERVE_ATTRACTOR",
            "consequence": "A convergent signal is reframed as a relation among moving bodies.",
            "priority": 90,
            "serendipityEligible": false
          },
          {
            "target": "C",
            "relationId": "B_TO_C_SIGNAL_BECOMES_TRACE",
            "condition": "ACTION_ISOLATE_ECHO",
            "consequence": "One signal echo becomes an inspectable archive trace.",
            "priority": 85,
            "serendipityEligible": false
          },
          {
            "target": "M",
            "relationId": "B_TO_M_CONVERGENCE_RESONANCE",
            "condition": "M_PORTAL_AVAILABLE AND TWO_SIGNAL_DECISIONS_COMMITTED",
            "consequence": "The attractor becomes an optional orientation portal rather than a compulsory destination.",
            "priority": 70,
            "serendipityEligible": false
          },
          {
            "target": "Y",
            "relationId": "B_TO_Y_SIGNAL_RETURN",
            "condition": "Y_ELIGIBLE",
            "consequence": "The Return records how signal selection shaped the route.",
            "priority": 50,
            "serendipityEligible": false
          }
        ],
        "portalToM": {
          "state": "RESONANT",
          "conditions": ["SIGNAL_OBSERVED", "AT_LEAST_TWO_COMMITTED_ACTIONS_IN_SESSION"],
          "returnBehavior": "RESTORE_B_OR_B_PRIME_WITH_ATTRACTOR_MEMORY"
        }
      },
      "interaction": {
        "meaningfulActions": [
          {
            "id": "OBSERVE_ATTRACTOR",
            "label": "Observe the attractor",
            "kind": "ACTIVATE",
            "consequence": "Increases convergence and makes relational exits available.",
            "memoryWrites": ["B_ATTRACTOR_OBSERVED", "VORTEX_OBSERVED"]
          },
          {
            "id": "ISOLATE_ECHO",
            "label": "Isolate one echo",
            "kind": "TRACE_RELATION",
            "consequence": "Selects a persistent signal that later reappears as an archive trace.",
            "memoryWrites": ["B_ECHO_ISOLATED", "DELAYED_ECHO_PENDING"]
          }
        ],
        "passiveEffects": ["POINTER_ATTRACTOR_OFFSET", "AUDIO_MODULATION_WITHOUT_IDENTITY_INFERENCE"]
      },
      "memory": {
        "reads": ["A_ORIENTATION_SIGNAL", "B_ECHO_ISOLATED", "VISIT_COUNT_B"],
        "writes": ["B_ATTRACTOR_OBSERVED", "B_ECHO_ISOLATED", "DELAYED_ECHO_PENDING"],
        "revisitMutation": "B′ reveals the previously isolated echo as a stable filament and changes one available exit."
      },
      "organism": {
        "family": "VORTEX",
        "presetId": "signal-vortex",
        "renderMode": "SHADER",
        "implementationStatus": "PROTOTYPE",
        "fallback": "/img/kodex/organisms/signal-vortex-fallback.svg",
        "reducedMotion": "LOW_FPS_ROTATION_OR_STATIC_CONVERGENCE_DIAGRAM",
        "semanticControls": {
          "signal": 0.82,
          "memory": 0.66,
          "entropy": 0.38,
          "cohesion": 0.62,
          "depth": 0.82,
          "convergence": 0.84
        },
        "contextualVariants": ["B_FIRST_VISIT", "B_PRIME_ECHO_STABILIZED"]
      },
      "presentationMode": "ORGANISM",
      "spectrum": {
        "entry": ["RED", "VIOLET"],
        "active": ["VIOLET", "CYAN"],
        "yContribution": ["SIGNAL_SELECTION", "CONVERGENCE_TRACE", "DELAYED_ECHO"]
      },
      "returnContribution": ["SELECTED_SIGNAL", "IGNORED_SIGNAL", "ECHO_REAPPEARANCE", "ATTRACTOR_RELATION"],
      "accessibility": {
        "keyboard": true,
        "touch": true,
        "reducedMotion": true,
        "motionOff": true,
        "nonVisualAlternative": true,
        "immediateExit": true
      }
    },
    {
      "coordinate": "C",
      "assignmentStatus": "NEEDS_CREATOR_APPROVAL",
      "structuralRole": "INTERWOVEN_CONCEPT_NODE",
      "concept": {
        "id": "archive-trace-field",